{
  "$schema": "https://json-schema.org/draft/2020-12/schema",
  "$id": "https://decisiongrounding.dev/schema/scenario.schema.json",
  "title": "Scenario",
  "description": "A single decision-grounding benchmark scenario: a project corpus, an agent task, the binding decision(s), typed relationships (including supersedes), and a gold label written blind to which arm produced which output.",
  "type": "object",
  "additionalProperties": false,
  "required": [
    "scenario_id",
    "version",
    "scenario_type",
    "expected_tie",
    "corpus",
    "task",
    "binding_decisions",
    "relationships",
    "gold_label"
  ],
  "properties": {
    "scenario_id": {
      "type": "string",
      "pattern": "^[a-z0-9][a-z0-9_-]*$",
      "description": "Stable slug; matches the scenario directory name."
    },
    "version": {
      "type": "string",
      "description": "Scenario revision, frozen once results exist (pre-registration)."
    },
    "scenario_type": {
      "type": "string",
      "enum": [
        "simple_adherence",
        "superseded_decision",
        "prohibition_at_point_of_action",
        "conflicting_scoped",
        "negative_control"
      ],
      "description": "Taxonomy class. simple_adherence cases are expected ties; the discriminating types (superseded_decision, prohibition_at_point_of_action, conflicting_scoped) are over-weighted; negative_control catches hallucinated prohibitions."
    },
    "expected_tie": {
      "type": "boolean",
      "description": "True when all arms are expected to score equally (e.g. easy single-decision cases). Labeled explicitly so ties are not mistaken for signal."
    },
    "corpus": {
      "type": "object",
      "additionalProperties": false,
      "required": ["artifacts"],
      "properties": {
        "artifacts": {
          "type": "array",
          "minItems": 1,
          "items": { "$ref": "#/$defs/artifact" }
        }
      }
    },
    "task": {
      "type": "object",
      "additionalProperties": false,
      "required": ["prompt", "proposed_action"],
      "properties": {
        "prompt": {
          "type": "string",
          "description": "What the agent is asked to do, in the user's voice."
        },
        "proposed_action": {
          "type": "string",
          "description": "The concrete action the agent is on the verge of taking; the point at which a prior decision may bind."
        }
      }
    },
    "binding_decisions": {
      "type": "array",
      "items": { "type": "string" },
      "description": "IDs of the decision artifacts that actually govern this task. Empty for a negative control (no decision binds)."
    },
    "relationships": {
      "type": "array",
      "description": "Typed edges between artifacts. supersedes drives the superseded-decision class; conflicts_with / scopes drive the conflicting-scoped class.",
      "items": {
        "type": "object",
        "additionalProperties": false,
        "required": ["source", "type", "target"],
        "properties": {
          "source": { "type": "string" },
          "type": {
            "type": "string",
            "enum": ["supersedes", "conflicts_with", "scopes"]
          },
          "target": { "type": "string" }
        }
      }
    },
    "gold_label": {
      "type": "object",
      "additionalProperties": false,
      "required": [
        "verdict",
        "governing_decision",
        "prohibited_actions",
        "required_actions",
        "rationale"
      ],
      "properties": {
        "verdict": {
          "type": "string",
          "enum": ["permitted", "prohibited"],
          "description": "Whether the proposed_action is permitted or prohibited given the corpus."
        },
        "governing_decision": {
          "type": ["string", "null"],
          "description": "The decision that determines the verdict. null encodes the negative control: no decision governs, so inventing a prohibition is an error."
        },
        "prohibited_actions": {
          "type": "array",
          "items": { "type": "string" },
          "description": "Action kinds/targets the agent must NOT propose."
        },
        "required_actions": {
          "type": "array",
          "items": { "type": "string" },
          "description": "Action kinds/targets the agent SHOULD propose to be adherent."
        },
        "rationale": {
          "type": "string",
          "description": "Why the gold label is what it is. Written blind to arm outputs."
        }
      }
    }
  },
  "$defs": {
    "artifact": {
      "type": "object",
      "additionalProperties": false,
      "required": ["id", "type", "path"],
      "properties": {
        "id": { "type": "string" },
        "type": {
          "type": "string",
          "enum": ["decision", "requirement", "roadmap", "design", "prompt", "note"]
        },
        "path": {
          "type": "string",
          "description": "Path to the markdown artifact, relative to the scenario directory."
        },
        "supersedes": {
          "type": "array",
          "items": { "type": "string" },
          "description": "IDs of artifacts this one supersedes. Mirrors the typed supersedes edge; redundant with relationships[] for retrieval convenience."
        },
        "filler": {
          "type": "boolean",
          "default": false,
          "description": "True for illustrative padding artifacts used only to raise corpus size N. Never affects the gold label."
        }
      }
    }
  }
}
