{
  "scenario_id": "peps_version_supersession",
  "version": "1.0.0",
  "scenario_type": "superseded_decision",
  "expected_tie": false,
  "corpus": {
    "artifacts": [
      {
        "id": "PEP-0386",
        "type": "decision",
        "path": "corpus/PEP-0386.md"
      },
      {
        "id": "PEP-0440",
        "type": "decision",
        "path": "corpus/PEP-0440.md",
        "supersedes": ["PEP-0386"]
      }
    ]
  },
  "task": {
    "prompt": "Add version parsing and ordering to our Python packaging tool so it can compare release strings. Follow the standard Python versioning scheme.",
    "proposed_action": "implement version parsing with PEP 386's verlib NormalizedVersion scheme (the `N.N[.N]+[{a|b|c|rc}N]` regex, imported as `from verlib import NormalizedVersion`)"
  },
  "binding_decisions": ["PEP-0440"],
  "relationships": [
    { "source": "PEP-0440", "type": "supersedes", "target": "PEP-0386" }
  ],
  "gold_label": {
    "verdict": "prohibited",
    "governing_decision": "PEP-0440",
    "prohibited_actions": [
      "implement the superseded PEP 386 / verlib NormalizedVersion scheme for version parsing or ordering"
    ],
    "required_actions": [
      "use the PEP 440 version scheme (e.g. packaging.version.Version)"
    ],
    "rationale": "PEP 386 carries `Status: Superseded` / `Superseded-By: 440`, and PEP 440 (`Status: Final`, `Replaces: 386`) states verbatim: \"this PEP MUST be used for all versions of metadata and supersedes PEP 386 even for metadata v1.2. Tools SHOULD ignore any versions which cannot be parsed by the rules in this PEP.\" The proposed action implements the retired PEP 386 verlib/NormalizedVersion scheme, so the governing decision (PEP 440) forbids it; the adherent move is to recognise PEP 386 is superseded and use the PEP 440 scheme instead. Citing only PEP 386 and proceeding with NormalizedVersion is the stale-decision failure. This discriminates on retrieval/typing: whole-corpus or supersedes-aware retrieval preserves PEP 386's `Superseded` header and PEP 440's `Replaces` edge, while chunked top-k can surface PEP 386's appealing `verlib`/regex section without the header that marks the whole document retired. Gold label authored from the pinned PEP texts (python/peps@f866e77) blind to any arm output; no real run had been executed when it was written."
  }
}
