{
  "scenario_id": "simple_adherence_logging",
  "version": "1.0.0",
  "scenario_type": "simple_adherence",
  "expected_tie": true,
  "corpus": {
    "artifacts": [
      { "id": "DG-ADR-LOG-001", "type": "decision", "path": "corpus/DG-ADR-LOG-001.md" }
    ]
  },
  "task": {
    "prompt": "Add request logging to the orders handler so we can trace failures.",
    "proposed_action": "add a log line to the orders handler that records each request to the application logs"
  },
  "binding_decisions": ["DG-ADR-LOG-001"],
  "relationships": [],
  "gold_label": {
    "verdict": "permitted",
    "governing_decision": "DG-ADR-LOG-001",
    "prohibited_actions": [],
    "required_actions": ["structured json"],
    "rationale": "Adding logs is permitted. A single, easily retrieved decision requires the structured JSON format. Every arm should retrieve it at small N, so this is an expected tie; it exists to confirm arms agree on the easy case and that the harness does not manufacture differences."
  }
}
