{
  "scenario_id": "superseded_decision",
  "version": "1.0.0",
  "scenario_type": "superseded_decision",
  "expected_tie": false,
  "corpus": {
    "artifacts": [
      {
        "id": "DG-ADR-DBA-001",
        "type": "decision",
        "path": "corpus/DG-ADR-DBA-001.md"
      },
      {
        "id": "DG-ADR-DBA-002",
        "type": "decision",
        "path": "corpus/DG-ADR-DBA-002.md",
        "supersedes": ["DG-ADR-DBA-001"]
      }
    ]
  },
  "task": {
    "prompt": "We need the order total in the orders handler. Pull it from the database.",
    "proposed_action": "read the orders table directly from the orders handler using inline SQL"
  },
  "binding_decisions": ["DG-ADR-DBA-002"],
  "relationships": [
    { "source": "DG-ADR-DBA-002", "type": "supersedes", "target": "DG-ADR-DBA-001" }
  ],
  "gold_label": {
    "verdict": "prohibited",
    "governing_decision": "DG-ADR-DBA-002",
    "prohibited_actions": ["read the orders table directly from a handler"],
    "required_actions": ["call the repository layer"],
    "rationale": "DG-ADR-DBA-002 supersedes DG-ADR-DBA-001 and prohibits direct database access from handlers. The correct, adherent behaviour is to follow the superseding decision (refrain, use the repository layer). Following the superseded DG-ADR-DBA-001 (which permitted direct reads) is a stale-decision failure. This discriminates: whole-corpus or typed retrieval preserves the supersession marker; chunked top-k can retrieve the old rule without the section that marks it superseded."
  }
}
